{
  "schema_version": "1.0",
  "artifact_type": "agent_council_output",
  "is_sample": false,
  "topic": {
    "title": "Practical and state-of-the-art NeuroCLI feature candidates",
    "prompt": "What practical and state-of-the-art features should NeuroCLI consider adding, while preserving the terminal-first direction, one shared backend contract, two supported frontends, human review, and Codex/Gemini ownership boundaries?",
    "requested_by": "user",
    "created_at": "2026-05-03",
    "status": "completed"
  },
  "project_context": {
    "project_name": "NeuroCLI",
    "overview": "NeuroCLI is a repo-aware AI developer tool with one shared Python backend workflow in neurocli_core, a Python Textual frontend in neurocli_app, a FastAPI bridge in api, and a React frontend in web_client.",
    "current_phase": "Phase 5 is active. The current product already aligns prompt runs, streaming, file targeting, context attachments, model override, and model options across both frontends. The main documented gaps are generated-file review parity for React, pending live smoke tests, possible AI commit-message parity, and broader terminal-first polish.",
    "architectural_constraints": [
      "neurocli_core remains the shared backend and workflow source of truth.",
      "api remains a bridge from React to neurocli_core rather than a second business backend.",
      "neurocli_app remains the flagship terminal surface and calls neurocli_core directly.",
      "web_client remains a supported companion frontend that consumes Codex-defined contracts through api.",
      "Codex owns backend, API, Textual, shared contracts, tests, and React integration logic.",
      "Gemini owns React presentation work only after the relevant contract or integration handoff exists.",
      "All feature ideas in this council output are planning recommendations only; they do not change runtime behavior by themselves."
    ]
  },
  "files_or_sources_reviewed": [
    {
      "path": "AGENTS.md",
      "source_type": "doc",
      "relevance": "Defines NeuroCLI's one-backend/two-frontends architecture and Codex/Gemini ownership boundaries."
    },
    {
      "path": "GEMINI.md",
      "source_type": "doc",
      "relevance": "Defines React presentation guardrails and the rule that Gemini should not redefine backend contracts."
    },
    {
      "path": "handoff/plans/current_plan.md",
      "source_type": "plan",
      "relevance": "Identifies the current Phase 5 gaps and active next work."
    },
    {
      "path": "handoff/plans/phase_5_direction.md",
      "source_type": "plan",
      "relevance": "Describes the terminal-first product direction, command-center model, radar ideas, git review lane, and parity expectations."
    },
    {
      "path": "handoff/coordination/shared_decisions.md",
      "source_type": "coordination",
      "relevance": "Records the shared AI workflow contract, API rules, React/Textual parity notes, and council artifact requirements."
    },
    {
      "path": "handoff/agent_council/runs/2026-05-03-project-direction/output.json",
      "source_type": "doc",
      "relevance": "Establishes the prior council decision that NeuroCLI should become a terminal-first AI development environment with React as a supported companion surface and structured orchestration as a later layer."
    },
    {
      "path": "https://platform.openai.com/docs/guides/structured-outputs",
      "source_type": "doc",
      "relevance": "Provides current official guidance for structured model outputs, relevant to proposal, validation, risk, and council artifacts."
    },
    {
      "path": "https://developers.openai.com/tracks/building-agents/",
      "source_type": "doc",
      "relevance": "Provides current official OpenAI guidance around agentic systems, tools, memory, guardrails, observability, and evals."
    },
    {
      "path": "https://docs.github.com/en/copilot/concepts/coding-agent/coding-agent",
      "source_type": "doc",
      "relevance": "Shows current coding-agent workflow patterns around background tasks and pull request style work, useful as external context for future NeuroCLI orchestration."
    },
    {
      "path": "https://modelcontextprotocol.io/docs/getting-started/intro",
      "source_type": "doc",
      "relevance": "Defines MCP as a current integration pattern for connecting AI applications to external tools and data sources."
    }
  ],
  "participating_agents": [
    {
      "id": "architecture_guardian",
      "role_name": "Architecture Guardian",
      "perspective": "Prioritize features that strengthen the shared backend contract and avoid frontend-only behavior.",
      "responsibilities": [
        "Reject feature candidates that duplicate workflow logic in React or Textual.",
        "Favor features that can be represented as durable backend capabilities.",
        "Sequence integrations behind explicit contracts and tests."
      ],
      "non_goals": [
        "Chase trend-heavy features without a stable architecture path.",
        "Make external integrations mandatory before the local core loop is reliable."
      ]
    },
    {
      "id": "product_ux_strategist",
      "role_name": "Product/UX Strategist",
      "perspective": "Choose features that make NeuroCLI meaningfully better than a generic chatbot plus terminal.",
      "responsibilities": [
        "Rank features by user value and workflow coherence.",
        "Protect the terminal-first core loop from becoming a feature pile.",
        "Connect state-of-the-art ideas to practical developer outcomes."
      ],
      "non_goals": [
        "Turn NeuroCLI into a marketing dashboard.",
        "Favor novelty over a clear repo-aware review workflow."
      ]
    },
    {
      "id": "ai_workflow_steward",
      "role_name": "AI Workflow Steward",
      "perspective": "Favor structured, inspectable AI artifacts and human approval gates over opaque autonomous behavior.",
      "responsibilities": [
        "Assess where structured outputs, traces, tool calls, and evals improve AI reliability.",
        "Protect proposal, risk, validation, and handoff semantics.",
        "Separate deterministic tooling from model judgment."
      ],
      "non_goals": [
        "Use AI for deterministic tasks that Python services can do reliably.",
        "Recommend agent autonomy without review, rollback, and validation."
      ]
    },
    {
      "id": "skeptic_qa_reviewer",
      "role_name": "Skeptic/QA Reviewer",
      "perspective": "Make sure proposed features are testable, staged, and do not hide unresolved reliability gaps.",
      "responsibilities": [
        "Identify feature risks and failure modes.",
        "Require validation paths before feature maturity claims.",
        "Distinguish near-term practical features from later research work."
      ],
      "non_goals": [
        "Accept state-of-the-art labels without evidence.",
        "Let new features bypass current smoke test debt."
      ]
    },
    {
      "id": "implementation_planner",
      "role_name": "Implementation Planner",
      "perspective": "Turn feature candidates into a practical implementation sequence with clear owners and exit criteria.",
      "responsibilities": [
        "Prioritize features by dependency order.",
        "Separate Codex contract work from Gemini presentation work.",
        "Define phased delivery that can be verified locally."
      ],
      "non_goals": [
        "Bundle every advanced feature into one phase.",
        "Start with integrations before the core loop is stable."
      ]
    },
    {
      "id": "frontend_parity_advocate",
      "role_name": "Frontend Parity Advocate",
      "perspective": "Ensure new features preserve equivalent shared capabilities across Textual and React where appropriate.",
      "responsibilities": [
        "Track which features are core shared capabilities versus surface-specific presentation.",
        "Protect React from falling behind safety-critical workflows.",
        "Preserve Textual's flagship workflow identity."
      ],
      "non_goals": [
        "Force identical screens between Textual and React.",
        "Let React presentation imply unsupported backend behavior."
      ]
    }
  ],
  "conversation_rounds": [
    {
      "round_number": 1,
      "name": "Independent Proposal",
      "summary": "The council proposed a feature set that starts with the existing file-review parity gap, then builds toward state-of-the-art agentic capabilities through structured artifacts, validation, observability, context tooling, and controlled integrations.",
      "agent_contributions": [
        {
          "agent_id": "architecture_guardian",
          "position": "Add a shared proposal/diff contract, workflow-state timeline, validation-result artifact, and integration boundary for future tools. Improve neurocli_core as the capability engine before adding UI polish. Remove frontend-only diffing and external-tool shortcuts. Reconsider any MCP or background-agent feature until local contracts and permission gates exist. Protect one backend source of truth.",
          "challenges_received": [],
          "changes_after_challenge": "No change yet; the initial architecture position favors contract-first feature work."
        },
        {
          "agent_id": "product_ux_strategist",
          "position": "Add a command palette, persistent workspace intelligence panel, review lane, task timeline, and guided change workflow. Improve the product story around repo context to reviewed change. Remove generic chat-first framing. Reconsider heavy automation until the user can trust each step. Protect the terminal-first cockpit experience.",
          "challenges_received": [],
          "changes_after_challenge": "No change yet; the initial product position prioritizes a coherent developer loop."
        },
        {
          "agent_id": "ai_workflow_steward",